"brand","price","location","date","petrol"
"MOL",681,"Budapest VIII, Futó u.",2023-10-08,"diesel"
"OMV",680.9,"Budapest VIII, Baross u. 5. (Kálvin tér)",2023-10-08,"diesel"
"Shell",676.9,"Budapest IX, Haller u. 56.",2023-10-08,"diesel"
"OMV",680.9,"Budapest VIII, Teleki tér",2023-10-08,"diesel"
"Avia",677.9,"Budapest IX, Vágóhíd utca 13.",2023-10-08,"diesel"
"MOL",681,"Budapest VIII, Golgota tér (VIII.)",2023-10-08,"diesel"
"Orlen",681,"Budapest VIII, Orczy út 46-48.",2023-10-08,"diesel"
"MOL",681,"Budapest VIII, Kerepesi út 5-7.",2023-10-08,"diesel"
"Shell",676.9,"Budapest IX, Könyves Kálmán krt. 18-20",2023-10-08,"diesel"
"OMV",680.9,"Budapest IX, Mester u. 89.",2023-10-08,"diesel"
"OMV",680.9,"Budapest VIII, Könyves Kálmán krt. 76. (Könyves/Kőbányai sarok",2023-10-08,"diesel"
"OMV",680.9,"Budapest XI, Irinyi út 34-36.",2023-10-08,"diesel"
"Mobil Petrol",649.9,"Budapest IX, Könyves Kálmán körút 3/b",2023-10-08,"diesel"
"MOL",681,"Budapest XI, Irinyi u.45. (XI.)",2023-10-08,"diesel"
"Orlen",681,"Budapest IX, Kvassay Jenő út 3",2023-10-08,"diesel"
"MOL",681,"Budapest X, Könyves K. krt. 23.",2023-10-08,"diesel"
"OMV",680.9,"Budapest VIII, Kerepesi út 22.",2023-10-08,"diesel"
"MOL",681,"Budapest XI, Prielle Kornélia u. (XI.)",2023-10-08,"diesel"
"MOL",681,"Budapest IX, Gubacsi u. 27. (IX.)",2023-10-08,"diesel"
"MOL",681,"Budapest VIII, Hős u. 9. (VIII.)",2023-10-08,"diesel"
"OMV",680.9,"Budapest XI, Budafoki út 111.",2023-10-08,"diesel"
"OMV",680.9,"Budapest IX, Üllői út 137.",2023-10-08,"diesel"
"OMV",680.9,"Budapest IX, Gyáli út 30.",2023-10-08,"diesel"
"Orlen",681,"Budapest IX, Gyáli út (M5), Ecseri út 9. ",2023-10-08,"diesel"
"OMV",680.9,"Budapest X, Üllői út 110-112.",2023-10-08,"diesel"
"MOL",681,"Budapest XXI, Weiss Manfréd út 2.",2023-10-08,"diesel"
"Shell",665,"Budapest XIV, Kerepesi út 42-46.",2023-10-08,"diesel"
"OMV",680.9,"Budapest XIV, Hungária krt. 116-118.",2023-10-08,"diesel"
"Shell",676.9,"Budapest XI, Tétényi út 2.",2023-10-08,"diesel"
"MOL",681,"Budapest XIV, Hungária krt.83-85. (XIV.)",2023-10-08,"diesel"
"Shell",676.9,"Budapest I, Mészáros u. 56/A.",2023-10-08,"diesel"
"Shell",676.9,"Budapest IX, Kén u. 1.",2023-10-08,"diesel"
"Orlen",681,"Budapest XI, Bartók Béla út 105.",2023-10-08,"diesel"
"MOL",681,"Budapest I, Mészáros u. 19.",2023-10-08,"diesel"
"Orlen",681,"Budapest XIV, Mogyoródi út 22-32.",2023-10-08,"diesel"
"Shell",676.9,"Budapest VI, Dózsa György út 120.",2023-10-08,"diesel"
"Other",681,"Budapest X, Kőbányai út 55.",2023-10-08,"diesel"
"OMV",680.9,"Budapest XIV, Hungária krt. 175-177.",2023-10-08,"diesel"
"OMV",680.9,"Budapest XI, Budaörsi út 1. (BAH-csomópont)",2023-10-08,"diesel"
"Shell",676.9,"Budapest X, Kőbányai út 56.",2023-10-08,"diesel"
"MOL",681,"Budapest IX, Gyáli út 38236/441",2023-10-08,"diesel"
"Shell",665,"Budapest XIV, Egressy út 31-35.",2023-10-08,"diesel"
"MOL",681,"Budapest XI, Nagyszőlős u. 47-49. (4566/2 hrsz.)",2023-10-08,"diesel"
"Shell",676.9,"Budapest XI, Budafoki út 209-215.",2023-10-08,"diesel"
"Shell",676.9,"Budapest I, Alkotás u. 20-24.",2023-10-08,"diesel"
"OMV",680.9,"Budapest XIV, Fogarasi út 56/A.",2023-10-08,"diesel"
"MOL",681,"Budapest XIII, Váci út 19.",2023-10-08,"diesel"
"OMV",680.9,"Budapest II, Tölgyfa u. 1-3.",2023-10-08,"diesel"
"MOL",681,"Budapest XIV, Vágány u. 21. (XIV.)",2023-10-08,"diesel"
"MOL",681,"Budapest IX, Napfény u. 26. (IX.)",2023-10-08,"diesel"
"MOL",681,"Budapest XIV, Róna u. 170. (XIV.)",2023-10-08,"diesel"
"Shell",676.9,"Budapest II, Csalogány u. 55.",2023-10-08,"diesel"
"MOL",682,"Budapest XI, Hunyadi János út 2. (XI.)",2023-10-08,"diesel"
"OMV",680.9,"Budapest XI, Fehérvári út 166.",2023-10-08,"diesel"
"OMV",680.9,"Budapest XIII, Róbert Károly krt. 64-66.",2023-10-08,"diesel"
"OMV",680.9,"Budapest X, Kőrösi Csoma Sándor út",2023-10-08,"diesel"
"MOL",681,"Budapest XIX, Ady Endre út 22-26.",2023-10-08,"diesel"
"MOL",681,"Budapest XI, Szeghalom u.",2023-10-08,"diesel"
"OMV",680.9,"Budapest IX, Határ út - Soroksári út sarok",2023-10-08,"diesel"
"Shell",676.9,"Budapest XIX, Üllői út 233.",2023-10-08,"diesel"
"MOL",681,"Budapest X, Fehér u. 3. (X.) ",2023-10-08,"diesel"
"Other",681,"Budapest XIV, Ógyalla tér 1.",2023-10-08,"diesel"
"OMV",680.9,"Budapest XI, Budaörsi út 112.",2023-10-08,"diesel"
"Shell",676.9,"Budapest XIII, Népfürdő u. 14.",2023-10-08,"diesel"
"OMV",718.9,"Budapest XI, Balatoni út M1/M7 756/17 hrsz",2023-10-08,"diesel"
"MOL",681,"Budapest XXI, Kossuth L. u. 3. (XXI.) ",2023-10-08,"diesel"
"Other",681,"Budapest XI, Budaörsi út 126.",2023-10-08,"diesel"
"Orlen",681,"Budapest XI, Hunyadi J. út",2023-10-08,"diesel"
"MOL",681,"Budapest XIII, Pap Károly u. (XIII.)",2023-10-08,"diesel"
"Shell",676.9,"Budapest XI, Péterhegyi út 54.",2023-10-08,"diesel"
"Shell",676.9,"Budapest X, Kerepesi út 61.",2023-10-08,"diesel"
"OMV",680.9,"Budapest II, Szilágyi Erzsébet fasor 51.",2023-10-08,"diesel"
"OMV",680.9,"Budapest XI, Péterhegyi út 66-68. ",2023-10-08,"diesel"
"OMV",680.9,"Budapest XXI, Védgát utca 47.",2023-10-08,"diesel"
"MOL",681,"Budapest XI, Mezőkövesd út 1.",2023-10-08,"diesel"
"MOL",681,"Budapest XIV, Csömöri út 27/A",2023-10-08,"diesel"
"MOL",681,"Budapest XX, Ady Endre út 67.",2023-10-08,"diesel"
"MOL",681,"Budapest XI, Rétköz utca (XI.)",2023-10-08,"diesel"
"Orlen",681,"Budapest X, Gyömrői út 56-62.",2023-10-08,"diesel"
"OMV",680.9,"Budapest X, Maglódi út - Jászberényi út sarok",2023-10-08,"diesel"
"MOL",681,"Budapest XII, Istenhegyi u.55. (XII.)",2023-10-08,"diesel"
"OMV",680.9,"Budapest XIV, Kacsóh Pongrác út 131.",2023-10-08,"diesel"
"Shell",676.9,"Budapest XIII, Béke út 58.",2023-10-08,"diesel"
"OMV",680.9,"Budapest XIV, Tengerszem u. 61-67.",2023-10-08,"diesel"
"OMV",680.9,"Budapest XIII, Váci út 95.",2023-10-08,"diesel"
"MOL",681,"Budapest III, Árpád fejedelem út 103.",2023-10-08,"diesel"
"Other",663,"Budapest XI, Hunyadi János u. 19. Savoya Park",2023-10-08,"diesel"
"OMV",680.9,"Budapest X, Kerepesi út 73.",2023-10-08,"diesel"
"Other",0,"Budapest XXI, Csepel Művek Főkapu, Színesfém u. 23.",2023-10-08,"diesel"
"Shell",664.9,"Budapest XIV, Fogarasi út 183.",2023-10-08,"diesel"
"Other",658,"Budapest X, Maglódi út 12/B",2023-10-08,"diesel"
"Shell",676.9,"Budapest X, Sibrik Miklós út 30.",2023-10-08,"diesel"
"Other",663.9,"Budapest X, Sibrik-Gyömrői sarok",2023-10-08,"diesel"
"MOL",681,"Budapest XIX, Nagykőrösi út (XIX.) 88.",2023-10-08,"diesel"
"Shell",676.9,"Budapest XIV, Füredi út 63.",2023-10-08,"diesel"
"OMV",680.9,"Budapest XX, Nagykőrösi út 185",2023-10-08,"diesel"
"Shell",676.9,"Budapest II, Szilágyi E. fasor 125.",2023-10-08,"diesel"
"Other",674,"Budapest X, Gyömrői út 105.",2023-10-08,"diesel"
"OMV",680.9,"Budapest XXII, Hajó út, Ártér u. 5.",2023-10-08,"diesel"
"MOL",681,"Budapest XIX, Üllői út 303.",2023-10-08,"diesel"
"Avia",0,"Budapest X, Keresztúri út 108/a.",2023-10-08,"diesel"
"OMV",680.9,"Budapest XV, Alkotmány út 14-20.",2023-10-08,"diesel"
"MOL",681,"Budapest XXI, Szent István út  (XXI.)",2023-10-08,"diesel"
"MOL",681,"Budapest XIII, Váci út 178. (XIII.)",2023-10-08,"diesel"
"Shell",676.9,"Budapest XI, Budaörsi út 118.",2023-10-08,"diesel"
"MOL",681,"Budapest XXIII, Helsinki u. 108-112.",2023-10-08,"diesel"
"Shell",676.9,"Budapest XXI, Csepel, Rákóczi Ferenc út 182.",2023-10-08,"diesel"
"Mobil Petrol",663.9,"Budapest XIX, Citroen utca 2. ",2023-10-08,"diesel"
"Shell",676.9,"Budapest XI, Balatoni út",2023-10-08,"diesel"
"MOL",681,"Budapest III, Szentendrei út 100.",2023-10-08,"diesel"
"Shell",676.9,"Budapest XVIII, Gyömrői út 156.",2023-10-08,"diesel"
"Shell",676.9,"Budapest IV, Pozsonyi út 1.",2023-10-08,"diesel"
"MOL",681,"Budapest III, Szentendrei út 59/a",2023-10-08,"diesel"
"Other",673,"Budapest XV, Rákospalotai határút 14.",2023-10-08,"diesel"
"MOL",681,"Budapest III, Mozaik u. 3.",2023-10-08,"diesel"
"OMV",680.9,"Budapest XXI, II. Rákóczi Ferenc út 189.",2023-10-08,"diesel"
"MOL",681,"Budapest XIX, Puskás F. u. (XIX.)  ",2023-10-08,"diesel"
"Shell",676.9,"Budapest XIII, Váci út 196.",2023-10-08,"diesel"
"Avia",0,"Budapest XXI, II. Rákóczi Ferenc u. 195-197.",2023-10-08,"diesel"
"Mobil Petrol",663.9,"Budapest X, Jászberényi út 53.",2023-10-08,"diesel"
"Other",0,"Budapest XVIII, Lakatos út 61-63.",2023-10-08,"diesel"
"Shell",676.9,"Budapest III, Bécsi út 277. A",2023-10-08,"diesel"
"MOL",681,"Budaörs, Repülőtér (Kinizsi u. 4047/2 hrsz.)",2023-10-08,"diesel"
"Shell",676.9,"Budapest XV, Szentmihályi út 152.",2023-10-08,"diesel"
"MOL",681,"Budapest XXII, Nagytétényi út",2023-10-08,"diesel"
"Shell",676.9,"Budapest XX, Mártírok útja 281.",2023-10-08,"diesel"
"MOL",681,"Budapest XV, Szentmihályi út 148.",2023-10-08,"diesel"
"OMV",680.9,"Budapest XV, Szentmihályi út 131.",2023-10-08,"diesel"
"OMV",680.9,"Budapest IV, Váci út 16.",2023-10-08,"diesel"
"Shell",676.9,"Budaörs, Kinizsi út 1-3.",2023-10-08,"diesel"
"OMV",680.9,"Budapest XV, Széchenyi tér 1.",2023-10-08,"diesel"
"MOL",681,"Budapest XIX, Méta u. - Zádor s.",2023-10-08,"diesel"
"Shell",676.9,"Budapest XXII, Nagytétényi út 27.",2023-10-08,"diesel"
"MOL",681,"Budapest III, Gémeskút u. 12.",2023-10-08,"diesel"
"MOL",681,"Budapest XVI, Arany J. u. 106. (XVI.)",2023-10-08,"diesel"
"MOL",681,"Budapest XVI, Veres Péter út 105-107.(XVI.)",2023-10-08,"diesel"
"OMV",680.9,"Budapest XXIII, Nagykőrösi út 349.",2023-10-08,"diesel"
"OMV",680.9,"Budapest II, Hűvösvölgyi út 118.",2023-10-08,"diesel"
"Other",669,"Budapest XVI, Margit u. 114.",2023-10-08,"diesel"
"Other",663,"Budapest XXI, Rákóczi Ferenc út 277.  Szigetszentmiklós",2023-10-08,"diesel"
"MOL",681,"Budaörs, Rubik Ernő u. 3.",2023-10-08,"diesel"
"MOL",681,"Budaörs, Garibaldi u. 2.",2023-10-08,"diesel"
"Shell",676.9,"Budapest XVIII, Méta u. Cziffra György utca",2023-10-08,"diesel"
"OMV",680.9,"Budapest XVI, Szlovák út - Csömöri út sarok",2023-10-08,"diesel"
"OMV",680.9,"Budapest XVIII, Haladás utca - Ráday út sarok",2023-10-08,"diesel"
"Other",663,"Budapest XXIII, Bevásárló u. 2. Soroksár",2023-10-08,"diesel"
"Other",679,"Budaörs, Szabadság út 110-120.",2023-10-08,"diesel"
"MOL",681,"Budapest II, Hűvösvölgyi út 136.",2023-10-08,"diesel"
"OMV",680.9,"Budapest IV, Váci út 77. - Megyeri út sarok",2023-10-08,"diesel"
"MOL",681,"Budapest IV, Fóti út 130.",2023-10-08,"diesel"
"MOL",681,"Budapest IV, Váci út 84-90.",2023-10-08,"diesel"
"Other",663,"Budaörs, Sport u. 2-4.",2023-10-08,"diesel"
"MOL",681,"Budapest XV, Bogáncs u. (XV.)",2023-10-08,"diesel"
"Shell",703.9,"Budapest XV, M3 12 km Észak - Szilas Pihenő",2023-10-08,"diesel"
"Shell",703.9,"Budapest XV, M3 12. km Dél - Szilas Pihenő",2023-10-08,"diesel"
"OMV",680.9,"Budapest III, Szentendrei út - Czetz J. u. sarok",2023-10-08,"diesel"
"Orlen",681,"Budapest XVI, Bökényföldi út 108.",2023-10-08,"diesel"
"MOL",681,"Budapest III, Szentendrei út 255.",2023-10-08,"diesel"
"OMV",680.9,"Budapest XVI, Szabadföldi út 1.",2023-10-08,"diesel"
"MOL",681,"Budapest XVIII, Üllői út 661. (XVIII.)",2023-10-08,"diesel"
"MOL",681,"Törökbálint, Raktárvárosi u. 3.",2023-10-08,"diesel"
"Orlen",681,"Budapest XVII, Pesti út 2.",2023-10-08,"diesel"
"OMV",680.9,"Budapest XXIII, Haraszti út 32/A",2023-10-08,"diesel"
"MOL",681,"Budapest XVII, Pesti út. 5. (XVII.)",2023-10-08,"diesel"
"Shell",703.9,"Szigetszentmiklós, M0 Szigetszentmiklós",2023-10-08,"diesel"
"Shell",676.9,"Budapest XVII, Pesti út 6.",2023-10-08,"diesel"
"Shell",676.9,"Budapest XXIII, Haraszti út 38./b",2023-10-08,"diesel"
"OMV",680.9,"Budapest III, Királyok útja 178.",2023-10-08,"diesel"
"MOL",681,"Budakeszi, Budaörsi u. 2749/8 hrsz.",2023-10-08,"diesel"
"Shell",676.9,"Budakeszi, Szőlőskert u. 1.",2023-10-08,"diesel"
"OMV",718.9,"Szigetszentmiklós, M0 19.km",2023-10-08,"diesel"
"MOL",681,"Budakeszi, Temető út (Hrsz.: 2405)",2023-10-08,"diesel"
"MOL",681,"Diósd, Tétényi u. 2. (hrsz 3666/1)",2023-10-08,"diesel"
"Shell",676.9,"Budapest III, Szentendrei út 373.",2023-10-08,"diesel"
"Shell",676.9,"Budapest III, Batthyány út 27.",2023-10-08,"diesel"
"OMV",680.9,"Budapest XVII, Pesti út 18.",2023-10-08,"diesel"
"Other",669.9,"Budakeszi, Bianka utca 1. ZONE Bevásárlópark",2023-10-08,"diesel"
"Shell",676.9,"Budapest XXIII, Ócsai u HRSZ 197969/5",2023-10-08,"diesel"
"Other",663,"Fót, Fehérkő u. 1.",2023-10-08,"diesel"
"MOL",681,"Budapest XXIII, Ócsai u.kimenő (XXIII.) 7.",2023-10-08,"diesel"
"OMV",680.9,"Budapest XVIII, Alacskai út 1.",2023-10-08,"diesel"
"MOL",681,"Budapest XVII, Cinkotai út 30.",2023-10-08,"diesel"
"OMV",680.9,"Budapest XVII, Cinkotai út 51.",2023-10-08,"diesel"
"OMV",680.9,"Üröm, Bécsi u. 2.",2023-10-08,"diesel"
"Other",673,"Budapest XVI, Simongát utca 2.",2023-10-08,"diesel"
"Orlen",681,"Szigetszentmiklós, Csepeli út 0188/80 hrsz",2023-10-08,"diesel"
"MOL",681,"Budapest XVIII, Üllői u.738. (XVIII.)",2023-10-08,"diesel"
"MOL",681,"Budapest XVI, Szabadföldi út 81.",2023-10-08,"diesel"
"Orlen",681,"Diósd, Balatoni út 11.",2023-10-08,"diesel"
"Shell",676.9,"Törökbálint, Park u. 1.",2023-10-08,"diesel"
"OMV",718.9,"Törökbálint, M0 körgyűrű 6 km",2023-10-08,"diesel"
"MOL",731,"Törökbálint, M0 autópálya 6 km. szelv.( Annahegyi pihenő) dél",2023-10-08,"diesel"
"MOL",681,"Diósd, Balatoni út 11.",2023-10-08,"diesel"
"Other",663,"Dunakeszi, Nádas u. 6.",2023-10-08,"diesel"
"MOL",681,"Budaörs, METRO  (Keleti utca)",2023-10-08,"diesel"
"Other",659,"Budapest XXII, Bányalég utca 108",2023-10-08,"diesel"
"Other",663,"Csömör, Határ út 6.",2023-10-08,"diesel"
"MOL",681,"Szigetszentmiklós, Petőfi Sándor utca 139",2023-10-08,"diesel"
"Shell",676.9,"Szigetszentmiklós, Csepeli út 19.",2023-10-08,"diesel"
"Other",663,"Budakalász, Omszk park 1.",2023-10-08,"diesel"
"Shell",676.9,"Szigetszentmiklós, II. Rákóczi Ferenc út 12. ",2023-10-08,"diesel"
"Shell",676.9,"Budapest XVII, Pesti út 237/c",2023-10-08,"diesel"
"Avia",678.9,"Nagytarcsa, Naplás utca 1. ",2023-10-08,"diesel"
"Other",0,"Nagytarcsa, Naplás u. 1.",2023-10-08,"diesel"
"Avia",678.9,"Nagytarcsa, 0135/50 hrsz.",2023-10-08,"diesel"
"Other",663,"Törökbálint, Torbágy u. 1.",2023-10-08,"diesel"
"MOL",681,"Vecsés, Fő út 6011/2 hrsz.",2023-10-08,"diesel"
"Shell",676.9,"Solymár, Rózsika u. 2.",2023-10-08,"diesel"
"Other",663,"Solymár, Szent Flórián u. 2-4.",2023-10-08,"diesel"
"Orlen",681,"Budapest XVII, Esztena u. 1.",2023-10-08,"diesel"
"Other",657.9,"Vecsés, Lőrinci utca 130",2023-10-08,"diesel"
"Other",0,"Budakalász, József Attila u. 75.",2023-10-08,"diesel"
"Other",675,"Budapest XVII, Pesti út 237. (Összekötő utca 4-6.)",2023-10-08,"diesel"
"Shell",676.9,"Vecsés, 4. sz. főút",2023-10-08,"diesel"
"Orlen",681,"Érd, Budafoki út (6.sz.főút)",2023-10-08,"diesel"
"OMV",680.9,"Dunaharaszti, Némedi u. sarok 51. sz. főút",2023-10-08,"diesel"
"Other",679,"Solymár, Sport u. 25.",2023-10-08,"diesel"
"Other",676,"Halásztelek, II. Rákóczi Ferenc út 29/10 hrsz. ",2023-10-08,"diesel"
"Shell",676.9,"Érd, Budafoki utca 2-4.",2023-10-08,"diesel"
"Other",663.9,"Érd, Erika u. 1.",2023-10-08,"diesel"
"MOL",681,"Érd, Budai út I.",2023-10-08,"diesel"
"MOL",681,"Érd, Budai út II.",2023-10-08,"diesel"
"OMV",680.9,"Kistarcsa, Szabadság u. 56.",2023-10-08,"diesel"
"MOL",681,"Dunaharaszti, Fő út 220. 510.-es főút",2023-10-08,"diesel"
"MOL",681,"Gyál, Körösi út  ",2023-10-08,"diesel"
"OMV",680.9,"Vecsés, Gyáli út 20-22.",2023-10-08,"diesel"
"Shell",676.9,"Dunakeszi, 2-es főút",2023-10-08,"diesel"
"Shell",676.9,"Fót, Szabadság út 10.",2023-10-08,"diesel"
"MOL",681,"Kerepes, Szabadság út  ",2023-10-08,"diesel"
"Oil",678,"Fót, Keleti Márton utca 7/a.",2023-10-08,"diesel"
"MOL",681,"Fót, Keleti Márton út",2023-10-08,"diesel"
"Orlen",681,"Dunakeszi, 2 sz. fõút",2023-10-08,"diesel"
"Shell",676.9,"Érd, Iparos út 42.",2023-10-08,"diesel"
"MOL",681,"Mogyoród, Hungaroring  ",2023-10-08,"diesel"
"OMV",680.9,"Szigetszentmiklós, Gyári út 3237 hrsz. ",2023-10-08,"diesel"
"MOL",681,"Pilisvörösvár, 10. sz. fkl. út (Hrsz. 0140/31.)",2023-10-08,"diesel"
"Other",671.9,"Gyál, M5 Gyál-Alsónémedi lehajtó",2023-10-08,"diesel"
"Other",666.9,"Dunaharaszti, 8601 hrsz.",2023-10-08,"diesel"
"Avia",675.9,"Érd, Szent László tér 6.",2023-10-08,"diesel"
"OMV",680.9,"Fót, Szabó Dezső u. 2/B.",2023-10-08,"diesel"
"OMV",680.9,"Szentendre, 11. sz. főút 17. km",2023-10-08,"diesel"
"Orlen",681,"Dunakeszi, Fő út 5152 hrsz.",2023-10-08,"diesel"
"MOL",681,"Pomáz, Árpád fejedelem u.",2023-10-08,"diesel"
"MOL",681,"Szigethalom, Petőfi Sándor u.  ",2023-10-08,"diesel"
"OMV",678,"Biatorbágy, Kossuth Lajos u. 1/a.",2023-10-08,"diesel"
"Orlen",681,"Szentendre, Dózsa Gy. út 20.",2023-10-08,"diesel"
"MOL",681,"Érd, Ercsi út hrsz. 26297/2",2023-10-08,"diesel"
"Other",674,"Ecser, Zrínyi u. 1.",2023-10-08,"diesel"
"OMV",0,"Érd, 6.sz. főút jobb 23km",2023-10-08,"diesel"
"OMV",0,"Érd, 6.sz. főút bal 23km",2023-10-08,"diesel"
"MOL",681,"Vecsés, M0 II. (bal) - Alacskai pihenő",2023-10-08,"diesel"
"Other",661.9,"Érd, Zámori út 4.",2023-10-08,"diesel"
"MOL",681,"Vecsés, M0 I. (jobb) - Alacskai pihenő",2023-10-08,"diesel"
"MOL",681,"Páty, 22-es km  észak (Sasfészek-tó) Páty",2023-10-08,"diesel"
"MOL",681,"Páty, 22-es km II. dél (Sasfészek-tó)",2023-10-08,"diesel"
"Other",663,"Maglód, Eszterházy János u. 1.",2023-10-08,"diesel"
"MOL",681,"Szentendre, Vasúti villasor 6.",2023-10-08,"diesel"
"MOL",681,"Pécel, Köztársaság tér  ",2023-10-08,"diesel"
"Orlen",681,"Pilisvörösvár, 10.sz.főút",2023-10-08,"diesel"
"MOL",681,"Dunakeszi, 2-es sz. főút 21. km",2023-10-08,"diesel"
"Shell",676.9,"Dunakeszi, 2/A főút Kelet",2023-10-08,"diesel"
"Shell",676.9,"Dunakeszi, 2/A főút Nyugat",2023-10-08,"diesel"
"Other",655,"Tököl, Ledina dűlő 4.",2023-10-08,"diesel"
"Oil",659,"Sóskút, Ipari Park",2023-10-08,"diesel"
"Oil",659,"Maglód, Liszt Ferenc utca 6/a",2023-10-08,"diesel"
"Other",650,"Üllő, Pesti út 209.",2023-10-08,"diesel"
"Orlen",730,"Gödöllő, M3-as Dél",2023-10-08,"diesel"
"Orlen",681,"Üllő, Pesti út (4.sz. főút)",2023-10-08,"diesel"
"Orlen",730,"Gödöllő, M3-as Észak",2023-10-08,"diesel"
"Avia",676.9,"Szentendre, Vasvári Pál u. 2794/16 hrsz.",2023-10-08,"diesel"
"OMV",680.9,"Alsónémedi, Alsónémedi 5. sz. főút",2023-10-08,"diesel"
"OMV",680.9,"Maglód, Jászberényi út",2023-10-08,"diesel"
"Other",676,"Göd, Nemeskéri - Kiss Miklós út 108",2023-10-08,"diesel"
"Other",680,"Göd, Nemeskéri út 49.",2023-10-08,"diesel"
"Oil",683,"Dunavarsány, Nagyvarsányi utca 155.",2023-10-08,"diesel"
"MOL",681,"Gödöllő, 3. sz. Főút Ipari Park, Pattantyús Ábrahám krt. 4.",2023-10-08,"diesel"
"Shell",676.9,"Százhalombatta, Damjanich u. 29.",2023-10-08,"diesel"
"MOL",681,"Százhalombatta, Bekötő út  ",2023-10-08,"diesel"
"MOL",681,"Piliscsaba, 10-es fő út 1602/13. hrsz. (24. km)",2023-10-08,"diesel"
"Other",0,"Százhalombatta, Ipari Park 6-os főút 067/4 hrsz. - adalékolt import üzemanyag értékesítés",2023-10-08,"diesel"
"Other",676.9,"Gödöllő, Repülőtéri u. 9.",2023-10-08,"diesel"
"MOL",681,"Gödöllő, Dózsa György út 61.",2023-10-08,"diesel"
"Other",671.9,"Üllő, K-Sped Krt. (Viktória Ipari Park)",2023-10-08,"diesel"
"MOL",680.9,"Etyek, Kossuth Lajos u. 72.",2023-10-08,"diesel"
"Shell",676.9,"Gödöllő, Dózsa Gy. út 108.",2023-10-08,"diesel"
"MOL",681,"Isaszeg, Rákóczi u. hrsz. 455",2023-10-08,"diesel"
"Other",0,"Ócsa, Üllői utca 41",2023-10-08,"diesel"
"Orlen",730,"Tárnok, M7 Autópálya 26 km DÉL",2023-10-08,"diesel"
"OMV",680.9,"Veresegyház, Fő u. 2/2.",2023-10-08,"diesel"
"Orlen",730,"Tárnok, M7 autópálya 26 km ÉSZAK",2023-10-08,"diesel"
"Oil",681,"Ócsa, Kiss János út 1.",2023-10-08,"diesel"
"MOL",681,"Gödöllő, Szabadság u.12.  ",2023-10-08,"diesel"
"MOL",681,"Veresegyház, Fő u.  ",2023-10-08,"diesel"
"Other",669,"Herceghalom, Jókai Mór u 2/A",2023-10-08,"diesel"
"MOL",681,"Százhalombatta, DUFI Olajmunkás út 2.",2023-10-08,"diesel"
"OMV",680.9,"Üllő, Pesti út 1.",2023-10-08,"diesel"
"Orlen",724,"Zsámbék, M1 autópálya (Észak)",2023-10-08,"diesel"
"Orlen",724,"Zsámbék, M1 autópálya (Dél)",2023-10-08,"diesel"
"MOL",681,"Leányfalu, Móricz Zsigmond út 165.",2023-10-08,"diesel"
"MOL",681,"Gyömrő, Mendei út  ",2023-10-08,"diesel"
"OMV",680.9,"Zsámbék, Herceghalmi út",2023-10-08,"diesel"
"MOL",731,"Ercsi, M6 I. (kimenő) (M6 külterület 30 km szelvény)",2023-10-08,"diesel"
"MOL",731,"Ercsi, M6 II. (bejövő) (M6 külterület 30 km szelvény)",2023-10-08,"diesel"
"Oil",673,"Erdőkertes, Fő út 234.",2023-10-08,"diesel"
"Avia",667,"Martonvásár, Bajcsy Zs. U. 31.",2023-10-08,"diesel"
"OMV",723.9,"Inárcs, M5 autópálya 82. kmsz. bal",2023-10-08,"diesel"
"OMV",723.9,"Inárcs, M5 autópálya 82. kmsz jobb",2023-10-08,"diesel"
"Shell",676.9,"Monor, Vasadi u. 1.",2023-10-08,"diesel"
"OMV",680.9,"Vác, Gödöllői út 1.",2023-10-08,"diesel"
"OMV",723.9,"Vál, M7, Kajászó (Váli Észak)",2023-10-08,"diesel"
"OMV",723.9,"Vál, M7, Kajászó (Váli Dél)",2023-10-08,"diesel"
"MOL",681,"Kiskunlacháza, Hadház u. 2.  ",2023-10-08,"diesel"
"MOL",0,"Inárcs, Széchenyi utca 14.",2023-10-08,"diesel"
"MOL",681,"Vác, Diadal tér",2023-10-08,"diesel"
"MOL",681,"Bicske, Botond tér  ",2023-10-08,"diesel"
"Oil",0,"Monor, Gép utca 1. ",2023-10-08,"diesel"
"Avia",680.9,"Iklad, Alsómajor 057/59 hrsz.",2023-10-08,"diesel"
"Other",671.9,"Bag, M3 autópálya 39. km lehajtó (Ipari Park) 2191",2023-10-08,"diesel"
"MOL",681,"Vác, Balassagyarmati út 1.",2023-10-08,"diesel"
"Other",668,"Aszód, Pesti út 25.",2023-10-08,"diesel"
"OMV",680.9,"Bag, Dózsa György út 2.",2023-10-08,"diesel"
"Shell",676.9,"Sülysáp, Pesti út 56.",2023-10-08,"diesel"
"MOL",681,"Aszód, Pesti út 3.  ",2023-10-08,"diesel"
"MOL",681,"Visegrád, 11.sz.fkl. út",2023-10-08,"diesel"
"Other",0,"Csolnok, Külterület hrsz. 0182/3.",2023-10-08,"diesel"
"MOL",681,"Monor, 4.sz. fkl. út (Katalin Csárda)  ",2023-10-08,"diesel"
"OMV",680.9,"Dorog, Bécsi út -Csolnoki út sarok hrsz.0279/8",2023-10-08,"diesel"
"Other",685,"Bicske, M1 autópálya mellett (39. km szelvény) bejárat 1. főútról",2023-10-08,"diesel"
"MOL",681,"Nagymaros, Váci út 119.",2023-10-08,"diesel"
"MOL",681,"Ráckeve, Kossuth L. u.  ",2023-10-08,"diesel"
"Other",675,"Felcsút, Fő út 220.",2023-10-08,"diesel"
"Avia",0,"Aszód, Falujárók útja 44.",2023-10-08,"diesel"
"MOL",681,"Dabas, 50.sz.fkl. út  ",2023-10-08,"diesel"
"Other",680,"Penc, Rákóczi u. 0255/38 hrsz.",2023-10-08,"diesel"
"MOL",681,"Dorog, Bécsi út",2023-10-08,"diesel"
"Avia",684,"Kápolnásnyék, 7. sz. főút 43. km",2023-10-08,"diesel"
"Other",693,"Hévízgyörk, Ady Endre út 71. ELADÓ!",2023-10-08,"diesel"
"MOL",681,"Kartal, Rákóczi út 1.",2023-10-08,"diesel"
"OMV",680.9,"Esztergom, Kertváros, Dobogókői út - Kesztölci út sarok",2023-10-08,"diesel"
"Other",683.9,"Újhartyán, Dragon Benz töltőállomás",2023-10-08,"diesel"
"OMV",680.9,"Óbarok, M 1 43. km jobb",2023-10-08,"diesel"
"Other",677,"Szob, Dózsa György út. hrsz. 179/15",2023-10-08,"diesel"
"Other",682,"Óbarok, M1 autópálya 43. km bal oldal",2023-10-08,"diesel"
"OMV",680.9,"Óbarok, M 1 43. km bal",2023-10-08,"diesel"
"Other",681,"Iváncsa, Hunyadi utca 782/1. ",2023-10-08,"diesel"
"Shell",676.9,"Esztergom, Mátyás Király út 37.",2023-10-08,"diesel"
"MOL",681,"Berettyóújfalu, 42-47 főút kereszteződés Honvéd u. 2.",2023-10-08,"diesel"
"MOL",731,"Velence, M7. autópálya I.  észak",2023-10-08,"diesel"
"MOL",681,"Adony, 6.sz. fkl. út  ",2023-10-08,"diesel"
"MOL",731,"Velence, M7. autópálya II.  dél",2023-10-08,"diesel"
"MOL",681,"Esztergom, Visegrádi út",2023-10-08,"diesel"
"Other",683,"Hernád, Köztársaság út 45/D OUT BENZINKÚT BT",2023-10-08,"diesel"
"Other",681,"Lovasberény, Vörösmarty u. 12. ",2023-10-08,"diesel"
"Other",671.9,"Tarján, Kossuth tér",2023-10-08,"diesel"
"OMV",680.9,"Dömsöd, Tassi út 16.",2023-10-08,"diesel"
"MOL",731,"Hatvan, M3 I. - Kerekharaszti pihenő - észak",2023-10-08,"diesel"
"MOL",731,"Hatvan, M3 II. - Kerekharaszti pihenő - észak",2023-10-08,"diesel"
"Avia",677.9,"Tápióbicske, Új út 1. ",2023-10-08,"diesel"
"Other",0,"Albertirsa, Béke u. 43.",2023-10-08,"diesel"
"MOL",681,"Gárdony, Szabadság u.  9",2023-10-08,"diesel"
"MOL",681,"Galgaguta, Kossuth u. 27.  ",2023-10-08,"diesel"
"MOL",681,"Hatvan, Rákóczi út 101",2023-10-08,"diesel"
"OMV",681,"Csákvár, Széchenyi u. 82",2023-10-08,"diesel"
"Other",675,"Tolmács, Hrsz: 0133/22 a 2-es számú főút Tolmácsi Leágazás",2023-10-08,"diesel"
"OMV",680.9,"Rétság, Pusztaszántói út 1.",2023-10-08,"diesel"
"Other",672,"Pátka, Külterület 0190/101 (GP benzinkút)",2023-10-08,"diesel"
"Shell",676.9,"Hatvan, Bibó István u. 1.",2023-10-08,"diesel"
"Shell",676.9,"Hatvan, Radnóti tér 20.",2023-10-08,"diesel"
"Shell",676.9,"Tatabánya, 1. főút 53. km",2023-10-08,"diesel"
"MOL",681,"Rétság, 2.sz. fkl. út  ",2023-10-08,"diesel"
"Orlen",681,"Nyergesújfalu, Bécsi út 2",2023-10-08,"diesel"
"MOL",681,"Nagykáta, Ady Endre u.  ",2023-10-08,"diesel"
"Avia",652.9,"Jászfényszaru, Külterület 05/150 hrsz.",2023-10-08,"diesel"
"OMV",680.9,"Tatabánya, Ságvári út - Károlyi Mihály u. 2.",2023-10-08,"diesel"
"MOL",681,"Hatvan, Elkerülő út",2023-10-08,"diesel"
"MOL",681,"Palotás, Szabadság út",2023-10-08,"diesel"
"MOL",681,"Kunszentmiklós, Szabadság u. 30.  ",2023-10-08,"diesel"
"MOL",681,"Lőrinci, 21.sz. fkl. út  ",2023-10-08,"diesel"
"Shell",676.9,"Tatabánya, Köztársaság út 1",2023-10-08,"diesel"
"Other",0,"Szabadegyháza, Külterület",2023-10-08,"diesel"
"MOL",681,"Hatvan, Csányi út (Sport u. 1.)",2023-10-08,"diesel"
